{
  "id": "formats/wav/read_metadata",
  "title": "Metadata chunks: bext, cue with adtl labels, smpl loops, INFO text and kept chunks",
  "juce_tag": "9.0.4",
  "tolerance": "exact",
  "wp": "WP-2.1-14",
  "ledger_rows": ["juce_audio_formats/WavAudioFormat"],
  "docs": [{"page": "WavAudioFormat", "member": "createReaderFor", "says": "Creates a reader for a WAV stream; returns nullptr when the stream is not a format it can read."}, {"page": "AudioFormatReader", "member": "read", "says": "Integer samples are converted to floats in the range -1 to 1 when the destination is floating point."}, {"page": "WavAudioFormat", "member": "bwavDescription", "says": "Metadata key for the BWAV description; the other bwav* keys name the remaining bext fields."}, {"page": "WavAudioFormat", "member": "riffInfoTitle", "says": "Metadata key for the RIFF INFO title; riffInfo* keys name the other INFO fields."}],
  "files": {
    "bext": {"chunks": [{"id": "fmt ", "hex": "01000100401f0000803e000002001000"}, {"id": "bext", "hex": "646573630000000000000000000000000000000000000000000000000000000000000000000000000000000000000000000000000000000000000000000000000000000000000000000000000000000000000000000000000000000000000000000000000000000000000000000000000000000000000000000000000000000000000000000000000000000000000000000000000000000000000000000000000000000000000000000000000000000000000000000000000000000000000000000000000000000000000000000000000000000000000000000000000000000000000000000000000000000000000000000000000000000000000000000000006f726967000000000000000000000000000000000000000000000000000000007265660000000000000000000000000000000000000000000000000000000000323032362d31302d323731323a33343a3536020000000100000000000000000000000000000000000000000000000000000000000000000000000000000000000000000000000000000000000000000000000000000000000000000000000000000000000000000000000000000000000000000000000000000000000000000000000000000000000000000000000000000000000000000000000000000000000000000000000000000000000000000000000000000000000000000000000000000000000000000000000000000000000000000000000000000000000000000000000000000000000000000000000000000000000000000000000000000000000000000000000000000000000000000000000000000000000000413d50434d2c463d34383030300d0a0000"}, {"id": "data", "hex": "0000000000000000"}]},
    "bext_umid": {"chunks": [{"id": "fmt ", "hex": "01000100401f0000803e000002001000"}, {"id": "bext", "hex": "646573630000000000000000000000000000000000000000000000000000000000000000000000000000000000000000000000000000000000000000000000000000000000000000000000000000000000000000000000000000000000000000000000000000000000000000000000000000000000000000000000000000000000000000000000000000000000000000000000000000000000000000000000000000000000000000000000000000000000000000000000000000000000000000000000000000000000000000000000000000000000000000000000000000000000000000000000000000000000000000000000000000000000000000000000006f726967000000000000000000000000000000000000000000000000000000007265660000000000000000000000000000000000000000000000000000000000323032362d31302d323731323a33343a3536020000000100000001010101010101010101010101010101010101010101010101010101010101010101010101010101010101010101010101010101010101010101010101010101010101010101010101010101010101010101010101010101010101010101010101010101010101010101010101010101010101010101010101010101010101010101010101010101010101010101010101010101010101010101010101010101010101010101010101010101010101010101010101010101010101010101010101010101010101010101010101010101010101010101010101010101010101010101010101010101010101010101010101010101010101010101010101010101413d50434d2c463d34383030300d0a0000"}, {"id": "data", "hex": "0000000000000000"}]},
    "cues_labels_notes": {"chunks": [{"id": "fmt ", "hex": "01000100401f0000803e000002001000"}, {"id": "cue ", "hex": "03000000010000000100000064617461000000000000000001000000020000000200000064617461000000000000000002000000030000000300000064617461000000000000000003000000"}, {"id": "LIST", "hex": "6164746c6e6f74650b0000000100000061206e6f746500006c61626c0a000000010000007665727365006e6f74650e000000020000006f6e6c79206e6f746500"}, {"id": "data", "hex": "0000000000000000"}]},
    "smpl_loops": {"chunks": [{"id": "fmt ", "hex": "01000100401f0000803e000002001000"}, {"id": "smpl", "hex": "000000000000000000000000000000000000000000000000000000000300000000000000070000000000000000000000010000000000000000000000070000000100000001000000020000000000000003000000070000000200000002000000030000000000000001000000"}, {"id": "data", "hex": "0000000000000000"}]},
    "smpl_other_type": {"chunks": [{"id": "fmt ", "hex": "01000100401f0000803e000002001000"}, {"id": "smpl", "hex": "000000000000000000000000000000000000000000000000000000000200000000000000070000000000000000000000010000000000000000000000070000002000000001000000020000000000000000000000"}, {"id": "data", "hex": "0000000000000000"}]},
    "info_tags": {"chunks": [{"id": "fmt ", "hex": "01000100401f0000803e000002001000"}, {"id": "LIST", "hex": "494e464f494e414d060000005469746c6500494152540700000041727469737400004950524406000000416c62756d0049474e520600000047656e726500494352440500000032303236000049434d5405000000436166e900004954524b02000000330049434f500400000028632900495346540500000053797270000049454e4705000000456e67000000"}, {"id": "data", "hex": "0000000000000000"}]},
    "kept_chunks": {"chunks": [{"id": "fmt ", "hex": "01000100401f0000803e000002001000"}, {"id": "acid", "hex": "616263"}, {"id": "inst", "hex": "616263"}, {"id": "iXML", "hex": "616263"}, {"id": "axml", "hex": "616263"}, {"id": "Trkn", "hex": "616263"}, {"id": "cart", "hex": "616263"}, {"id": "JUNK", "hex": "000000000000"}, {"id": "fact", "hex": "04000000"}, {"id": "data", "hex": "0000000000000000"}]}
  },
  "steps": [
    {"op": "read", "args": ["bext"]},
    {"op": "read", "args": ["bext_umid"]},
    {"op": "read", "args": ["cues_labels_notes"]},
    {"op": "read", "args": ["smpl_loops"]},
    {"op": "read", "args": ["smpl_other_type"]},
    {"op": "read", "args": ["info_tags"]},
    {"op": "read", "args": ["kept_chunks"]}
  ]
}
